review_id,year,trip_type,aspect,sentiment,score,evidence,rating
561631516,2018,solo,ritual_experience,positive,0.85,the entire process of worshiping the god is amazing,5
561631516,2018,solo,crowd_management,negative,0.3,time of Shivaratri is tough time to get in,5
561631516,2018,solo,spiritual_authenticity,positive,0.8,sadhus sitting on the Bagmati riverside are always peaceful,5
569409402,2018,unknown,ritual_experience,positive,0.7,hindus people visit every day for praying,5
437339190,2016,solo,cultural_sensitivity,neutral,0.5,entering the Hindu temple is forbidden for non hinduists,5
437339190,2016,solo,facility,negative,0.3,"Beware of tourist scams, guides, souvenirs and similar",5
437339190,2016,solo,spiritual_authenticity,positive,0.9,your life will be different after,5
467793395,2017,unknown,cultural_sensitivity,positive,0.7,everybody from sadhus to tourist peacefully together,5
467793395,2017,unknown,ritual_experience,neutral,0.5,cremations and funerals going on all the time,5
895389122,2023,family,cultural_sensitivity,neutral,0.5,Photography is strictly prohibited inside the main temple,5
895389122,2023,family,spiritual_authenticity,positive,0.8,Amazing vibes,5
271884767,2015,family,environment,positive,0.8,complex is clean and well maintained,4
271884767,2015,family,sacred_atmosphere,positive,0.85,symbol of Hindu Culture,4
271884767,2015,family,crowd_management,negative,0.4,high inflow of tourists and worshippers,4
351276727,2016,unknown,access_fairness,negative,0.3,Entrance fees are too expensive,4
351276727,2016,unknown,spiritual_authenticity,positive,0.8,famous for its holiness,4
323073750,2015,couples,spiritual_authenticity,positive,0.8,visit this place to understand life better,5
653170713,2019,solo,sacred_atmosphere,positive,0.8,"full of various lights, sound and smells",5
653170713,2019,solo,spiritual_authenticity,positive,0.9,center of Hinduism,5
646331145,2019,family,environment,negative,0.3,on the bank of dirty bagmati river,3
646331145,2019,family,crowd_management,negative,0.2,mile long cue of believers,3
646331145,2019,family,sacred_atmosphere,negative,0.4,jostling for view of the god,3
646331145,2019,family,spiritual_authenticity,positive,0.6,sacred interior of the temple,3
447359913,2016,family,crowd_management,negative,0.3,crowded with people pushing for darshan,4
447359913,2016,family,sacred_atmosphere,positive,0.8,site of God in His form is heart warming,4
447359913,2016,family,environment,negative,0.4,places of destruction still remaining following the earthquake,4
447359913,2016,family,facility,negative,0.3,no proper road with chaos at the entrance,4
447359913,2016,family,spiritual_authenticity,positive,0.9,experience of the Divine is never less,4
330933662,2015,friends,sacred_atmosphere,positive,0.7,good place to visit at least once in life time,5
330933662,2015,friends,environment,negative,0.3,bad smell and smokey environment,5
330933662,2015,friends,spiritual_authenticity,positive,0.6,great heritage site,5
366620480,2016,friends,sacred_atmosphere,positive,0.8,A very interesting and worthwhile place to visit,5
712988009,2019,couples,service,positive,0.9,beautiful friendly people,5
333251106,2015,solo,spiritual_authenticity,positive,0.7,Important place for Hindu,5
333251106,2015,solo,sacred_atmosphere,positive,0.8,interesting place for me,5
150477426,2013,friends,sacred_atmosphere,positive,0.9,environment is itself devoted,5
150477426,2013,friends,spiritual_authenticity,positive,0.85,Must visit place for the travelers,5
255143178,2015,friends,sacred_atmosphere,positive,0.8,somewhere different world,5
255143178,2015,friends,spiritual_authenticity,positive,0.7,become more profound to see the dead bodies burning to ashes,5
530350370,2017,solo,ritual_experience,positive,0.8,an experience you just have to witness to see the love,5
530350370,2017,solo,spiritual_authenticity,positive,0.85,a memorable experience that'll burn deep in your soul,5
530350370,2017,solo,cultural_sensitivity,negative,0.3,Holy Men charging for photos from tourists,5
530350370,2017,solo,sacred_atmosphere,positive,0.7,pleasant women blessing visitors with red rice Tilak Blessings,5
241112299,2014,solo,access_fairness,negative,0.3,no clear signs as to what part of the temple complex non-Hindus could enter,5
241112299,2014,solo,sacred_atmosphere,positive,0.8,experience was moving and sincere,5
241112299,2014,solo,cultural_sensitivity,positive,0.7,"tourist were taking photos, but they were respectful of the family",5
241112299,2014,solo,environment,positive,0.7,more monkeys than the so-called 'Monkey Temple',5
416656693,2016,business,sacred_atmosphere,positive,0.8,nice and largest Shiva temple,5
416656693,2016,business,spiritual_authenticity,positive,0.7,really historically,5
635802182,2018,family,ritual_experience,positive,0.9,Very nice experience of taking darshan of lord Shiva,5
635802182,2018,family,sacred_atmosphere,positive,0.85,one gets a divine feeling after taking darshanam,5
635802182,2018,family,environment,negative,0.3,Construction work was happening in the temple area,5
635802182,2018,family,crowd_management,negative,0.4,Heavy crowd was experienced as it was a weekly off,5
212485493,2014,friends,ritual_experience,positive,0.7,Pretty interesting ceremony,5
212485493,2014,friends,access_fairness,neutral,0.5,You can go in without paying the fee (1000nrps for foreigners) after 6.45pm,5
569221118,2018,friends,sacred_atmosphere,positive,0.8,the whole ritual is emotional and I was just watching families,5
569221118,2018,friends,spiritual_authenticity,positive,0.7,worth a visit,5
496762683,2017,unknown,facility,negative,0.2,poorly signed and dirty place,2
496762683,2017,unknown,access_fairness,negative,0.3,do not allow non Hindus into the temple proper,2
300473016,2015,friends,ritual_experience,positive,0.9,evening Aarti here...most beautiful,5
300473016,2015,friends,sacred_atmosphere,positive,0.85,architecture was fascinating,5
300473016,2015,friends,spiritual_authenticity,positive,0.8,first cremation ceremony here,5
877490066,2023,solo,ritual_experience,positive,0.8,An experience I shall never forget,5
877490066,2023,solo,spiritual_authenticity,positive,0.85,not a sad event but a celebration of the life,5
877490066,2023,solo,facility,positive,0.7,a guide took me around and explained,5
131355719,2012,solo,cultural_sensitivity,positive,0.7,Just remember no pictures of the family and the cremation,4
131355719,2012,solo,environment,negative,0.3,the river is filthy,4
131355719,2012,solo,access_fairness,neutral,0.5,You can visit all areas except the inside the Temple itself and the cremation area unless you are Hindu,4
131355719,2012,solo,sacred_atmosphere,positive,0.6,Don't pass on an opportunity to visit here,4
625230450,2018,solo,access_fairness,negative,0.3,quite expensive to get in (1000npr),4
625230450,2018,solo,facility,negative,0.4,"guide not to follow me around, as it really made the experience much worse",4
625230450,2018,solo,service,negative,0.3,everybody is nice at a price,4
625230450,2018,solo,sacred_atmosphere,positive,0.7,"Overall, I did enjoy the place",4
607365459,2018,family,ritual_experience,positive,0.9,evening Aarati was enthralling,5
607365459,2018,family,cultural_sensitivity,neutral,0.5,photography not allowed inside the temple,5
667546336,2019,family,sacred_atmosphere,positive,0.9,beautiful temple with good vibrations,5
667546336,2019,family,ritual_experience,positive,0.9,"evening Arti, it is simply divine",5
268024060,2015,family,cultural_sensitivity,neutral,0.5,only Hindu to visit inside the main campus,4
268024060,2015,family,environment,positive,0.7,surrounded by a big park,4
268024060,2015,family,environment,positive,0.7,behind is a big lake,4
247934392,2015,unknown,spiritual_authenticity,positive,0.8,After workship mind become so peacefull,5
387351587,2016,couples,spiritual_authenticity,positive,0.7,can pray here,3
343286543,2016,solo,access_fairness,neutral,0.5,entrance fee was a high 1000 rupee. But it was worth it,4
343286543,2016,solo,facility,positive,0.7,local tour guide that will be very friendly,4
343286543,2016,solo,sacred_atmosphere,positive,0.8,Great atmosphere for love birds enjoying the view,4
343286543,2016,solo,environment,positive,0.8,sit and relax with the cooling wind and Sun on your face,4
201918621,2014,solo,ritual_experience,neutral,0.5,face to face with death,3
651928020,2019,friends,spiritual_authenticity,positive,0.8,pilgrims forever reverent,5
651928020,2019,friends,sacred_atmosphere,positive,0.7,flock to Pashupatinath in any weather condition,5
446400749,2016,friends,sacred_atmosphere,positive,0.9,"dedicated to Lord Shiva, the Guardian Deity of Nepal",5
446400749,2016,friends,ritual_experience,positive,0.85,morning and evening aarati,5
446400749,2016,friends,spiritual_authenticity,positive,0.9,final death rituals are conducted,5
130951937,2012,couples,access_fairness,neutral,0.5,you're not able to enter the main Temple if you're a Westerner,5
130951937,2012,couples,facility,positive,0.7,"worth getting a guide, they're cheap enough",5
130951937,2012,couples,sacred_atmosphere,positive,0.8,it's a lovely place,5
130951937,2012,couples,cultural_sensitivity,positive,0.6,money goes to the up keep of Pashupatinath,5
264567816,2015,solo,spiritual_authenticity,positive,0.9,could found my soul here sitting for hours and meditating,5
590640756,2018,business,facility,positive,0.7,Very large car park,3
590640756,2018,business,environment,positive,0.6,fairly clean,3
590640756,2018,business,service,negative,0.3,very poor signage and absence of guides,3
590640756,2018,business,sacred_atmosphere,neutral,0.5,difficult for us as tourists to appreciate the grandeur,3
149360818,2013,friends,access_fairness,negative,0.3,not all accessible to non Hindus,4
149360818,2013,friends,cultural_sensitivity,negative,0.4,sadhus WILL want money for a photo,4
149360818,2013,friends,sacred_atmosphere,positive,0.7,well worth a visit for a couple of hours,4
149360818,2013,friends,ritual_experience,neutral,0.5,"cremations taking place, which I found interesting, but some may not",4
678197971,2019,unknown,sacred_atmosphere,positive,0.8,"On having Darshan, you get peace and tranquility",5
678197971,2019,unknown,environment,negative,0.3,"Baghmati river being one of the holiest, is very filthy due to lack of maintainance",5
160428118,2013,family,spiritual_authenticity,negative,0.3,sadhus (or holy men) are fake and are only after money,5
160428118,2013,family,environment,negative,0.3,river is almost dry,5
160428118,2013,family,facility,negative,0.4,guides will take you in the daytime - but that's pointless,5
160428118,2013,family,sacred_atmosphere,negative,0.3,kids on drugs (glue sniffing),5
423041812,2016,family,sacred_atmosphere,positive,0.9,sense of peace and tranquillity,4
423041812,2016,family,environment,positive,0.8,beautiful sight to see,4
423041812,2016,family,facility,neutral,0.5,could be a little cleaner,4
423041812,2016,family,spiritual_authenticity,positive,0.85,lack of commercialization makes this a very pleasant place of worship,4
558067433,2018,solo,ritual_experience,positive,0.9,experience there is astonishing,5
558067433,2018,solo,sacred_atmosphere,positive,0.85,This is very emotional,5
608292320,2018,friends,sacred_atmosphere,positive,0.8,this place is very powerful,5
296774993,2015,unknown,sacred_atmosphere,neutral,0.5,vibration here was not so high,3
296774993,2015,unknown,spiritual_authenticity,positive,0.6,it worth anyway to go,3
166924324,2013,couples,ritual_experience,neutral,0.5,every bhakta has to smoke to make happy for shiva,5
435377451,2016,couples,sacred_atmosphere,positive,0.8,there is something very human and fundamental here,4
435377451,2016,couples,cultural_sensitivity,negative,0.3,felt like intruders as devotees bid farewell,4
435377451,2016,couples,spiritual_authenticity,positive,0.7,if there really is reincarnation,4
242930372,2014,friends,ritual_experience,neutral,0.5,cremations held here all the time,5
242930372,2014,friends,sacred_atmosphere,negative,0.3,I felt odd/rude staying too long to watch the cremations,5
242930372,2014,friends,access_fairness,negative,0.4,There was a 1000 rupee charge ($10 USD),5
436488656,2016,solo,spiritual_authenticity,positive,0.85,one of the most interesting places,5
310539834,2015,solo,facility,positive,0.9,Hats off to the maintenance team for maintaining this wonderful temple,5
310539834,2015,solo,sacred_atmosphere,positive,0.85,The whole atmosphere is full of positive vibrations,5
310539834,2015,solo,spiritual_authenticity,positive,0.9,absolutely peaceful and feeling relaxed,5
310539834,2015,solo,environment,positive,0.9,neat and clean Temple,5
207481104,2014,solo,access_fairness,negative,0.3,The fee to get in was the highest I paid: 1000 nrs for a westerner,4
207481104,2014,solo,cultural_sensitivity,neutral,0.5,"As a non-Hindu, I could not enter the temple",4
207481104,2014,solo,facility,negative,0.4,tour guide problem for western (and female) tourists,4
743484386,2020,unknown,sacred_atmosphere,positive,0.8,some kind of peace about this place,5
743484386,2020,unknown,ritual_experience,neutral,0.5,watch them burn. But there was some kind of peace,5
536137833,2017,business,access_fairness,neutral,0.5,Access to the inside of the temple is restricted to Hindus only,5
714381280,2019,family,cultural_sensitivity,negative,0.3,not allowed to access the temple,3
714381280,2019,family,ritual_experience,negative,0.4,quite confronting to watch,3
714381280,2019,family,crowd_management,negative,0.2,man who offered to purchase my teenage daughter,3
149054120,2013,couples,sacred_atmosphere,positive,0.8,"this is a very sacred, important place",4
149054120,2013,couples,ritual_experience,negative,0.4,for a westerner it is quite disturbing,4
149054120,2013,couples,spiritual_authenticity,positive,0.7,fasinating in another,4
259595223,2015,couples,access_fairness,neutral,0.5,ask for 1000NPR entrance which was fine,4
259595223,2015,couples,service,negative,0.4,"guide followed us, gave us a really interesting tour but demanded $10",4
259595223,2015,couples,sacred_atmosphere,positive,0.8,Incredible site to see,4
164549652,2013,friends,crowd_management,positive,0.7,not crowded,5
164549652,2013,friends,environment,negative,0.4,more cleanliness desirable,5
164549652,2013,friends,sacred_atmosphere,positive,0.8,Location divine,5
164549652,2013,friends,access_fairness,negative,0.3,people should be allowed to stay inside a few more moments,5
180129961,2013,solo,spiritual_authenticity,positive,0.8,nice place to get peace,5
180129961,2013,solo,access_fairness,neutral,0.5,Only Hindus are allowed to enter the temple,5
335449037,2015,solo,spiritual_authenticity,positive,0.8,experience and learn about the traditions and religion,5
335449037,2015,solo,sacred_atmosphere,positive,0.85,witness live the processions and ceremony,5
521268807,2017,family,facility,positive,0.7,"tour guide from our hotel, which I highly recommend",5
521268807,2017,family,ritual_experience,neutral,0.5,very humbling and yet awkward to watch families mourning,5
521268807,2017,family,environment,positive,0.8,grounds are lovely to walk around,5
521268807,2017,family,crowd_management,negative,0.3,harassed by vendors,5
478999195,2017,solo,sacred_atmosphere,positive,0.9,one of beautiful shiva temple,5
478999195,2017,solo,spiritual_authenticity,positive,0.85,must visit temple for shiva devootes,5
478999195,2017,solo,facility,positive,0.7,people also really nice and explain about history,5
946640111,2024,couples,sacred_atmosphere,positive,0.9,sanctuary of peace and tranquility,5
946640111,2024,couples,spiritual_authenticity,positive,0.85,awe of its profound spiritual significance,5
410334696,2016,couples,service,positive,0.7,tipped our guide and headed in the direction of our next destination,4
410334696,2016,couples,facility,negative,0.3,vendors that kept approaching me and trying to sell me crap,4
410334696,2016,couples,cultural_sensitivity,neutral,0.5,Only Hindus are allowed to enter the actual main temple,4
410334696,2016,couples,spiritual_authenticity,positive,0.8,pragmatic view of death; it's just another part of life,4
648048280,2019,family,ritual_experience,positive,0.7,Hindu people standing in queue for pooja,5
648048280,2019,family,environment,neutral,0.5,famous for monkeys,5
648048280,2019,family,crowd_management,neutral,0.5,standing in queue for pooja mostly in festivals,5
122102013,2011,business,spiritual_authenticity,positive,0.8,Inspiring site,5
675022045,2019,solo,cultural_sensitivity,neutral,0.5,limitations for non-Hindus,4
675022045,2019,solo,sacred_atmosphere,positive,0.7,events at the Bagmati River seem solemn and personal,4
675022045,2019,solo,crowd_management,negative,0.4,hundreds of local 'spectators',4
470982927,2017,solo,sacred_atmosphere,positive,0.8,beauty of temple premises made to overthink,5
470982927,2017,solo,cultural_sensitivity,negative,0.3,Only Hindu and Buddhist are allowed in a core of temple,5
470982927,2017,solo,spiritual_authenticity,positive,0.7,learning of a cultural difference and a beauty of tradition,5
441659354,2016,solo,facility,negative,0.3,challenged by a guard,3
441659354,2016,solo,sacred_atmosphere,neutral,0.5,Interesting place but not riveting,3
143686072,2012,friends,ritual_experience,neutral,0.5,Didn't really enjoy watching the deceased being cremated but I guess these experiences are all part of travelling,4
143686072,2012,friends,spiritual_authenticity,negative,0.3,Not sure if they're really holy or not,4
641370101,2018,couples,access_fairness,negative,0.3,1000R per person is excessive,3
641370101,2018,couples,cultural_sensitivity,neutral,0.5,restricted to Hindus only,3
641370101,2018,couples,sacred_atmosphere,positive,0.7,A must to visit this extensive Temple,3
241924882,2014,friends,sacred_atmosphere,positive,0.8,peaceful and quite good,4
241924882,2014,friends,spiritual_authenticity,positive,0.85,best of the religious areas we visited,4
241924882,2014,friends,cultural_sensitivity,neutral,0.5,had to cross his palm with silver,4
239096638,2014,friends,facility,negative,0.3,entrance fee was 1000 Nepalesse rupees,3
239096638,2014,friends,service,negative,0.3,guide fee was expensive,3
444449832,2016,family,sacred_atmosphere,positive,0.8,interesting place for everyone to see,3
444449832,2016,family,crowd_management,negative,0.3,gets quite crowded,3
444449832,2016,family,spiritual_authenticity,positive,0.7,important pilgrimage for Hindus,3
925420584,2023,friends,access_fairness,negative,0.3,Only Hindus are allowed to enter the temple,4
925420584,2023,friends,facility,neutral,0.5,buying a ticket at the tourist office,4
925420584,2023,friends,sacred_atmosphere,positive,0.7,"watch the main temple, funeral ceremonies and cremations",4
351848957,2016,solo,environment,positive,0.8,this place is amazing and culturally fascinating,5
351848957,2016,solo,ritual_experience,positive,0.7,quite an amazing place for knowledge and reflection,5
351848957,2016,solo,facility,positive,0.7,hiring a guide so you do not miss any details,5
351848957,2016,solo,sacred_atmosphere,positive,0.8,amazing place for knowledge and reflection,5
579347795,2018,solo,facility,positive,0.8,I really liked the way footwear is collected and stored,5
579347795,2018,solo,sacred_atmosphere,positive,0.85,It was a pleasure to visit this place,5
574418031,2018,family,access_fairness,negative,0.3,Tourists have to pay to get in can't remember how much but Indians and Locals go free,3
574418031,2018,family,facility,neutral,0.5,there appears to be more than one entrance,3
574418031,2018,family,ritual_experience,neutral,0.5,we saw lots of cremations,3
574418031,2018,family,service,negative,0.3,He will ask for $30 AFTER he's taken you around. It's a con,3
574418031,2018,family,facility,positive,0.6,There is the facility to wash your feet should you wish,3
620774828,2018,friends,spiritual_authenticity,positive,0.8,"It reflects traditional arts, custom, and culture",5
620774828,2018,friends,sacred_atmosphere,positive,0.7,funeral spot for Hindu people and they believe to do that in this temple,5
138557117,2012,solo,ritual_experience,neutral,0.5,they do cremate bodies,5
138557117,2012,solo,cultural_sensitivity,negative,0.3,people at funerals don't think of them as something for tourists to take photos of,5
138557117,2012,solo,sacred_atmosphere,positive,0.7,you'll have a very interesting and fun time,5
138557117,2012,solo,environment,neutral,0.5,watch those monkeys,5
568678578,2018,friends,spiritual_authenticity,positive,0.8,considered to be one of the most important temple for Hindus,5
258911119,2015,couples,spiritual_authenticity,positive,0.8,contemplated the different culture,5
258911119,2015,couples,facility,neutral,0.5,didn't use a guide,5
205474254,2014,family,ritual_experience,positive,0.8,thought provoking and contemplative experience,4
205474254,2014,family,spiritual_authenticity,positive,0.85,gives an enhanced understanding of local culture,4
205474254,2014,family,cultural_sensitivity,positive,0.9,At no stage did our presence feel unwelcome or out of place,4
124146945,2012,solo,spiritual_authenticity,positive,0.8,see and feel the end of life processes,5
333105763,2015,unknown,sacred_atmosphere,positive,0.8,admiring the spirituality and amazing architecture,5
333105763,2015,unknown,environment,negative,0.3,inevitable poverty of people,5
358325375,2016,friends,ritual_experience,neutral,0.5,"poignant scenes and, some quite gruesome to watch",5
358325375,2016,friends,environment,negative,0.3,frolicking monkeys who are always looking for a bite to eat,5
563094867,2018,business,service,positive,0.8,tour guide handle it,5
563094867,2018,business,cultural_sensitivity,neutral,0.5,areas that are off limits to foreigners,5
717467121,2019,unknown,spiritual_authenticity,positive,0.8,complex religious significance of this place,5
717467121,2019,unknown,facility,positive,0.7,Get a good guide in your own language,5
338386734,2016,couples,sacred_atmosphere,positive,0.8,beautiful place to visit,4
338386734,2016,couples,environment,negative,0.3,very dirty and crowded,4
338386734,2016,couples,facility,neutral,0.5,my guide told me,4
289000356,2015,friends,sacred_atmosphere,positive,0.8,I love this place,5
639380245,2018,couples,facility,neutral,0.5,gallery with vendors selling drinks and foods,2
639380245,2018,couples,access_fairness,negative,0.3,Non Hindus are not allowed into the temple,2
639380245,2018,couples,cultural_sensitivity,negative,0.4,hefty entry price,2
161068022,2013,solo,facility,positive,0.8,1-armed man of about 40 that was fantastic,5
161068022,2013,solo,environment,positive,0.7,site is extremely large with a lot of walking to do but well worth it,5
161068022,2013,solo,sacred_atmosphere,positive,0.85,Well worth the visit,5
660470891,2019,couples,ritual_experience,positive,0.9,amazing darshan during the special evening prayer,4
660470891,2019,couples,sacred_atmosphere,positive,0.8,One of the key holy sites for Lord Shiva,4
660470891,2019,couples,spiritual_authenticity,positive,0.85,A must visit for all Hindus travelling to Kathmandu,4
660470891,2019,couples,environment,negative,0.3,If you cannot stomach this avoid going to the river bank side,4
705518801,2019,unknown,cultural_sensitivity,neutral,0.5,non-Hindus can't enter,5
705518801,2019,unknown,facility,positive,0.7,Get a local guide - there's a lot to see,5
247398304,2015,couples,environment,negative,0.3,Monkeys all over the place,3
247398304,2015,couples,sacred_atmosphere,positive,0.7,the temple and the golden cow stand out,3
247398304,2015,couples,ritual_experience,negative,0.4,Skip the cremation area behind the temple,3
725310967,2019,solo,environment,negative,0.3,Government still didn t finish to rebuild after earthquake,4
430183790,2016,solo,ritual_experience,positive,0.8,cremation in the Hindu custom can be watched up close,4
430183790,2016,solo,service,positive,0.9,Our guide was incredibly informative and was able to answer every question,4
662624612,2019,family,sacred_atmosphere,positive,0.8,this is a place of living tradition and culture,4
662624612,2019,family,crowd_management,neutral,0.5,quite organized and there is no hustling,4
662624612,2019,family,environment,negative,0.3,the sight of the river was quite depressing,4
662624612,2019,family,cultural_sensitivity,positive,0.7,you have to enter without shoes of course,4
327405158,2015,solo,sacred_atmosphere,positive,0.8,magnificent Pagoda style temple with great architecture,4
327405158,2015,solo,cultural_sensitivity,neutral,0.5,Only Hindus are allowed to enter the temple,4
327405158,2015,solo,environment,positive,0.7,views from across the river are not bad,4
327405158,2015,solo,ritual_experience,negative,0.3,it is a place of sadness it is where the hindus bring their dead for cremation,4
535633978,2017,solo,access_fairness,neutral,0.5,"Access to the inside of the temple is restricted to Hindus only. Otherwise, the temple complex is open to all.",4
635061500,2018,friends,service,positive,0.85,the guide they provided was wonderful,5
635061500,2018,friends,facility,positive,0.8,HIMALAYAN SANCTUARY ADVENTURE ltd.,5
635061500,2018,friends,sacred_atmosphere,positive,0.8,a wonderful stop,5
239788667,2014,couples,facility,positive,0.8,the whole complex is very nicely maintained,5
239788667,2014,couples,crowd_management,positive,0.7,the flow of visitors was very smoth and darshan was easy without anybhassle,5
239788667,2014,couples,cultural_sensitivity,negative,0.3,foreign visitors retuning disappointed as they were not allowed entry,5
239788667,2014,couples,sacred_atmosphere,positive,0.9,A feeling of faith and peace is felt inside main temple complex,5
540122397,2017,friends,sacred_atmosphere,positive,0.85,Very beautiful architecture,4
540122397,2017,friends,spiritual_authenticity,positive,0.8,interesting traditions,4
145949227,2012,friends,sacred_atmosphere,positive,0.8,a powerful experience,4
145949227,2012,friends,cultural_sensitivity,positive,0.7,Respect to the families,4
