review_id,year,trip_type,aspect,sentiment,score,evidence,rating
213084971,2014,family,facility,negative,0.4,be aware of touts,4
405596619,2016,friends,sacred_atmosphere,positive,0.9,most sacred places in Nepal,5
307405044,2015,solo,sacred_atmosphere,positive,0.85,definitely make this a must see,5
123740275,2012,friends,cultural_sensitivity,neutral,0.5,entrance to the temple is only for Hindus,4
123740275,2012,friends,sacred_atmosphere,positive,0.8,this place is very spiritual,4
123740275,2012,friends,ritual_experience,positive,0.9,special ceremony beside the holy river,4
123740275,2012,friends,facility,negative,0.3,the only restroom around is in the main temple area,4
123740275,2012,friends,service,negative,0.3,some of them are fake people just aiming at money,4
387321675,2016,solo,sacred_atmosphere,positive,0.8,environment is quite spiritual,4
387321675,2016,solo,spiritual_authenticity,positive,0.7,enjoyed alot while worshiping and visiting,4
438679643,2016,couples,sacred_atmosphere,positive,0.8,The temple inside are very serene and you get feeling of calmness,4
438679643,2016,couples,facility,positive,0.7,pleasantly surprised by the cleanliness and the way people organise themselves,4
438679643,2016,couples,cultural_sensitivity,negative,0.3,disappointed that even in today's time it reads that only Hindu are allowed,4
438679643,2016,couples,spiritual_authenticity,positive,0.7,age hold Hindu traditions including cremation of dead bodies,4
359765940,2016,couples,ritual_experience,positive,0.8,"Burning the dead, according to the numerous rules and rituals, is very captivating and striking to see",4
359765940,2016,couples,spiritual_authenticity,negative,0.3,saddhus creating a very misinformed image,4
359765940,2016,couples,cultural_sensitivity,negative,0.4,saddhus we saw at Pashupatinath are attractions,4
315764720,2015,friends,sacred_atmosphere,positive,0.85,the entire place becomes a beautiful sea of red saris,4
315764720,2015,friends,spiritual_authenticity,positive,0.8,great location for seeing and experiencing festivals like Teej,4
745098689,2020,unknown,sacred_atmosphere,positive,0.8,impressive structures strung along the sides of the Bagmati river,5
745098689,2020,unknown,cultural_sensitivity,neutral,0.5,cannot actually enter the main actual temple unless you are a Hindu,5
745098689,2020,unknown,ritual_experience,positive,0.7,Hindu cremation rituals are practised day and night,5
745098689,2020,unknown,spiritual_authenticity,positive,0.8,sobering and thought provoking,5
216516272,2014,friends,ritual_experience,positive,0.8,enjoyed the Darshan and Pooja,5
216516272,2014,friends,facility,negative,0.4,cleanliness could have been better,5
216516272,2014,friends,spiritual_authenticity,positive,0.7,liked this attitude very much,5
556264669,2018,couples,spiritual_authenticity,positive,0.8,fascinating to see the temples and buildings,5
556264669,2018,couples,ritual_experience,positive,0.7,privileged to be able to watch the burial ceremonies,5
556264669,2018,couples,facility,positive,0.8,Our local guide was a great help,5
123232538,2012,friends,access_fairness,negative,0.3,non Hindus are not allowed to trespass the entrance,2
123232538,2012,friends,facility,negative,0.4,Once we payed the fee,2
123232538,2012,friends,sacred_atmosphere,negative,0.3,Not recommended,2
233382331,2014,family,sacred_atmosphere,positive,0.8,feel the atmosphere and witness right in front,5
233382331,2014,family,environment,negative,0.3,"white hospital, well, that really creepy",5
134722532,2012,solo,cultural_sensitivity,neutral,0.5,only hindus to pass in,4
134722532,2012,solo,facility,positive,0.6,heard by local guide,4
134722532,2012,solo,crowd_management,negative,0.3,little management skill missing,4
134722532,2012,solo,sacred_atmosphere,positive,0.7,every one has to Visit temple,4
366486389,2016,solo,ritual_experience,positive,0.8,interested in seeing Hindu devotees performing rituals,4
366486389,2016,solo,sacred_atmosphere,positive,0.7,"temple compound is quite big, and has a lot of interesting things to offer",4
347340196,2016,solo,sacred_atmosphere,positive,0.9,"extremely peaceful, calm",5
347340196,2016,solo,cultural_sensitivity,neutral,0.5,only be visited from Hindus,5
347340196,2016,solo,ritual_experience,positive,0.85,Wonderful,5
207558277,2014,family,sacred_atmosphere,positive,0.8,very lively place,5
207558277,2014,family,cultural_sensitivity,neutral,0.5,Hindus can go straight to the temple while others can see it from the other side of the Bridge,5
483551672,2017,solo,sacred_atmosphere,positive,0.8,beautiful place to meditate,5
483551672,2017,solo,crowd_management,negative,0.3,Huge turnout for holidays,5
376755897,2016,solo,sacred_atmosphere,neutral,0.5,An opportunity to see a different approach to death,5
419012280,2016,couples,spiritual_authenticity,positive,0.9,most sacred Temple of Bhagwan Shiv,5
469794651,2017,couples,environment,negative,0.2,place is dirty,3
469794651,2017,couples,cultural_sensitivity,negative,0.3,disrespectful (stupid!) tourists,3
469794651,2017,couples,sacred_atmosphere,negative,0.4,felt strange to be there,3
141107179,2012,friends,cultural_sensitivity,neutral,0.5,foreigners are not allowed into the main temples,5
141107179,2012,friends,sacred_atmosphere,positive,0.8,feeling of sanctity that permeates the whole environment,5
141107179,2012,friends,environment,positive,0.7,noise and pollution fall away and you can enjoy the feeling of peacefulness,5
750756597,2020,unknown,crowd_management,negative,0.3,temple will usually have long que,5
750756597,2020,unknown,environment,negative,0.3,roads are invariably jammed,5
422834113,2016,family,ritual_experience,positive,0.9,Maha Aarthi that happens around 1830hrs in the evening daily is a must see experience,5
547978228,2017,friends,sacred_atmosphere,positive,0.8,beautiful silver carvings all over the temple,5
547978228,2017,friends,cultural_sensitivity,neutral,0.5,Photography is not permitted in the temple,5
547978228,2017,friends,facility,positive,0.7,neatly maintained. lot of restoration work is on,5
542152676,2017,couples,ritual_experience,positive,0.8,evening worship of god shiva,5
462592140,2017,friends,spiritual_authenticity,positive,0.9,we belive and very much trust,5
462592140,2017,friends,sacred_atmosphere,positive,0.85,god bless ua always,5
317053896,2015,solo,access_fairness,negative,0.3,Non Hindus are not allowed and had to pay 1000 NPR,3
317053896,2015,solo,ritual_experience,positive,0.6,the cremation part was something to see,3
984953550,2024,solo,sacred_atmosphere,positive,0.8,made it feel all the more sacred like a pilgrimage,4
984953550,2024,solo,crowd_management,neutral,0.5,many tourists about,4
605470340,2018,couples,sacred_atmosphere,positive,0.9,"Super touching, beautiful!",5
605470340,2018,couples,cultural_sensitivity,neutral,0.5,Pay attention to the clothes you wear,5
605470340,2018,couples,environment,negative,0.3,it started rain very bad,5
829882741,2022,friends,sacred_atmosphere,positive,0.85,highly recommend for all,5
249677415,2015,unknown,access_fairness,negative,0.3,I genuinely could not afford to pay the admission fee,2
249677415,2015,unknown,facility,neutral,0.5,A man that worked at the ticket office followed me out and told me to come either very very early (6am) or late at night to get in for free,2
1055053598,2026,couples,ritual_experience,positive,0.85,"The Aarati ceremony was amazing though, really powerful",4
1055053598,2026,couples,facility,negative,0.3,pressed us into paying him an absurd amount for his 'tour',4
1055053598,2026,couples,cultural_sensitivity,positive,0.7,we felt very welcomed by others around us,4
133364905,2012,friends,facility,neutral,0.5,you choose if you want them to take you around,4
133364905,2012,friends,access_fairness,negative,0.3,do not want to pay the entrance fee,4
133364905,2012,friends,cultural_sensitivity,neutral,0.5,building where only hindus can get in,4
125335828,2012,unknown,cultural_sensitivity,positive,0.7,culturally it is interesting to see the puja and ceremony,4
577198216,2018,couples,ritual_experience,positive,0.8,Aarti...is worth watching,4
577198216,2018,couples,access_fairness,neutral,0.5,gate of the temple opens up only at specific time,4
392449221,2016,solo,access_fairness,negative,0.3,quite a high price i thought for entry,4
392449221,2016,solo,cultural_sensitivity,negative,0.4,none Hindu's are restricted to were they can go,4
392449221,2016,solo,sacred_atmosphere,neutral,0.6,overall worth a visit,4
573506692,2018,solo,spiritual_authenticity,positive,0.85,feel the spirituality and history in this place,5
378854688,2016,unknown,ritual_experience,positive,0.8,cremated here with religious honor,5
378854688,2016,unknown,spiritual_authenticity,positive,0.85,get in touch with religious mind,5
378854688,2016,unknown,cultural_sensitivity,positive,0.7,pay their last homage with due profound love,5
374902801,2016,family,spiritual_authenticity,positive,0.8,"religious place, funeral, belief",4
720283291,2019,unknown,service,positive,0.9,"Gyan did a wonderful job as a nice, patient and caring tour guide",5
720283291,2019,unknown,facility,positive,0.85,wonderful guidance of Gyan Bahadur Muhkiya,5
720283291,2019,unknown,ritual_experience,positive,0.8,watched the sacred ceremony with flowers and tears,5
720283291,2019,unknown,spiritual_authenticity,positive,0.85,were simply amazed,5
607942586,2018,family,sacred_atmosphere,positive,0.8,Visit was purely for religious purpose,4
607942586,2018,family,ritual_experience,positive,0.85,Evening Arti one must see,4
607942586,2018,family,facility,positive,0.7,good handicraft shop,4
607942586,2018,family,environment,neutral,0.5,Part of Temple was damaged in earthquake,4
566805481,2018,friends,cultural_sensitivity,negative,0.3,tourists aren't allowed in most of the temples (discrimination),4
566805481,2018,friends,facility,negative,0.4,over zealous guards will try to force you to pay 1000 rupees,4
566805481,2018,friends,environment,positive,0.8,so much jungle & so many monkeys,4
566805481,2018,friends,sacred_atmosphere,positive,0.7,opens a psychic channel,4
951165320,2024,couples,environment,negative,0.2,rubbish and dirt everywhere,3
951165320,2024,couples,ritual_experience,positive,0.7,emotionally moving to be able to witness the cremation,3
483868045,2017,solo,spiritual_authenticity,positive,0.8,shiva god called god of god,5
403918651,2016,solo,ritual_experience,positive,0.7,"to see river rituals, burning",5
403918651,2016,solo,sacred_atmosphere,positive,0.8,very nice and long walking among many attractions,5
382868824,2016,couples,ritual_experience,negative,0.3,not prepared for the cremations happening everywhere,4
382868824,2016,couples,facility,neutral,0.5,"guide nominated himself to us, he was at first annoying but then it was good",4
382868824,2016,couples,sacred_atmosphere,positive,0.7,such a memorable place to see and it's a must see,4
382868824,2016,couples,spiritual_authenticity,negative,0.4,not a place for children who are not prepared for what is happening,4
485920904,2017,family,spiritual_authenticity,positive,0.9,most preferred reason to visit,5
485920904,2017,family,sacred_atmosphere,positive,0.85,must visit place,5
1036234384,2025,friends,access_fairness,neutral,0.5,1000 rupee admission for tourists,5
1036234384,2025,friends,cultural_sensitivity,neutral,0.5,only open to Hindus,5
1036234384,2025,friends,environment,negative,0.3,not much shade,5
933891698,2024,couples,ritual_experience,positive,0.8,visually very exciting,5
933891698,2024,couples,cultural_sensitivity,negative,0.3,not allowing non-Hindus,5
933891698,2024,couples,sacred_atmosphere,positive,0.7,it is quieter,5
933891698,2024,couples,spiritual_authenticity,positive,0.8,funerals were more heartfelt,5
450311159,2017,couples,ritual_experience,positive,0.7,Watching the rites,4
450311159,2017,couples,spiritual_authenticity,positive,0.8,a very different culture,4
450311159,2017,couples,facility,positive,0.7,Our guide explained,4
450311159,2017,couples,sacred_atmosphere,neutral,0.5,gave an eerie feeling,4
353736651,2016,friends,facility,positive,0.7,highly recommend paying for a guide,5
645300204,2019,friends,cultural_sensitivity,neutral,0.5,Chinese people not like visit the temple much,4
645300204,2019,friends,spiritual_authenticity,positive,0.6,Good place to know more on local people,4
237413621,2014,couples,access_fairness,neutral,0.5,Only Hindus can go inside the temple,4
237413621,2014,couples,sacred_atmosphere,negative,0.3,it wasnt a pleasant site for me,4
237413621,2014,couples,spiritual_authenticity,positive,0.7,If you a Shiva devotee its definitely worth a visit,4
163346037,2013,friends,sacred_atmosphere,positive,0.8,Amazing photographic opportunities the seemingly infinite 15 votive shrines,5
163346037,2013,friends,cultural_sensitivity,negative,0.3,tourists getting to close to the cremations they should show more respect,5
325481378,2015,couples,sacred_atmosphere,positive,0.7,great historic & religious value,3
325481378,2015,couples,crowd_management,negative,0.3,It was crowded,3
317780308,2015,friends,crowd_management,neutral,0.5,if you visit very early in the morning or around noon the crowd is less,4
317780308,2015,friends,cultural_sensitivity,neutral,0.5,Photography is not allowed inside the main temple,4
623654219,2018,unknown,ritual_experience,positive,0.8,thousands of devotees during the month of Shivaratri festivals,4
449418805,2017,friends,facility,positive,0.7,worth a few extra bucks,5
449418805,2017,friends,ritual_experience,neutral,0.5,bodies were being burned while we were there,5
260287178,2015,unknown,ritual_experience,positive,0.8,superb rich cultural experience,3
260287178,2015,unknown,cultural_sensitivity,negative,0.3,Hindus are not allowed to go inside the temple,3
260287178,2015,unknown,facility,neutral,0.5,people coming to ask you if you need a guide,3
484463611,2017,friends,cultural_sensitivity,neutral,0.5,main temple is restricted to Hindus only,4
484463611,2017,friends,access_fairness,neutral,0.5,entrance fee is 1000 Rs,4
484463611,2017,friends,sacred_atmosphere,positive,0.8,amazed by the beauty of the site,4
484463611,2017,friends,spiritual_authenticity,positive,0.7,learn about Hindu customs and funeral rituals,4
538705903,2017,couples,ritual_experience,positive,0.8,do Shiva 's Puja in pashupatinath,5
538705903,2017,couples,spiritual_authenticity,positive,0.85,big opportunity for us,5
137326746,2012,solo,cultural_sensitivity,positive,0.8,No photography allowed,4
137326746,2012,solo,sacred_atmosphere,positive,0.7,Holy place,4
137326746,2012,solo,crowd_management,negative,0.3,very crowded,4
240493784,2014,family,ritual_experience,positive,0.8,the process is fascinating,4
240493784,2014,family,sacred_atmosphere,positive,0.7,you are not made to feel voyeuristic,4
884208089,2023,couples,environment,positive,0.7,nice place to visit,4
884208089,2023,couples,sacred_atmosphere,positive,0.8,shines Nepal culture and harmony among people,4
884208089,2023,couples,crowd_management,negative,0.3,busiest place with Mass Gathering,4
226620937,2014,family,facility,negative,0.3,there was no cleanliness,4
226620937,2014,family,ritual_experience,positive,0.8,the aarti experience was great,4
226620937,2014,family,sacred_atmosphere,positive,0.7,the place is marvellously built,4
356415771,2016,friends,spiritual_authenticity,positive,0.8,amazing insight into the Hindu culture,5
356415771,2016,friends,environment,negative,0.3,scabby monkeys that are everywhere,5
559520021,2018,business,sacred_atmosphere,positive,0.8,Visit to Kathmandu is not complete without visit to this place,5
559520021,2018,business,crowd_management,positive,0.7,gathering will be comparatively less,5
200288737,2014,solo,sacred_atmosphere,positive,0.9,extremely holy and spiritual experience,5
200288737,2014,solo,spiritual_authenticity,positive,0.85,divine and holy Pashupatinath Temple,5
946690611,2024,friends,sacred_atmosphere,positive,0.8,Beautiful temple in nepal,5
598094206,2018,friends,environment,negative,0.3,quite hot then,4
598094206,2018,friends,cultural_sensitivity,positive,0.7,advisable to visit either early in the morning or in the evening,4
551800966,2018,business,ritual_experience,positive,0.8,Arti at Bhagmati which itself is quite a sight,5
551800966,2018,business,crowd_management,negative,0.3,escape from heavy rush,5
551800966,2018,business,cultural_sensitivity,neutral,0.5,No prasad to be offered at temple,5
257552768,2015,solo,service,positive,0.9,We had an excellent guide,5
257552768,2015,solo,sacred_atmosphere,positive,0.85,the solemn cremation sites,5
257552768,2015,solo,spiritual_authenticity,positive,0.8,a very memorable experience,5
172466706,2013,friends,spiritual_authenticity,positive,0.7,interesting to learn about Hindu religion,5
172466706,2013,friends,environment,negative,0.4,area is bit not so clean,5
183894742,2013,friends,sacred_atmosphere,positive,0.85,walking around this beautiful site,5
183894742,2013,friends,ritual_experience,positive,0.7,see a cremation in progress,5
183894742,2013,friends,facility,positive,0.7,getting a guide to take you around,5
390262798,2016,solo,ritual_experience,positive,0.8,very easy to have darshana of Lord Shiva,4
236529288,2014,solo,sacred_atmosphere,positive,0.8,holiy holy for all hindu,5
236529288,2014,solo,spiritual_authenticity,positive,0.7,you think of life what about when you view live burn death body,5
319205869,2015,friends,sacred_atmosphere,positive,0.9,a very peaceful and soulful place,5
319205869,2015,friends,cultural_sensitivity,neutral,0.5,nobody is allowed to touch the Linga,5
677248246,2019,friends,environment,negative,0.3,river is holy but extremely dirty,5
677248246,2019,friends,ritual_experience,negative,0.4,left me disturbed for sometime,5
677248246,2019,friends,spiritual_authenticity,positive,0.7,left me with unusually calm feeling,5
677248246,2019,friends,cultural_sensitivity,neutral,0.5,only Hindus are allowed in to the temple,5
173763678,2013,solo,environment,negative,0.3,"place was dirty, crowded and noisy",3
173763678,2013,solo,sacred_atmosphere,positive,0.8,temple itself is lovely,3
173763678,2013,solo,spiritual_authenticity,positive,0.7,"amazing place to walk about, or sit under some shade and just meditate / chill",3
628701476,2018,family,access_fairness,neutral,0.5,You can not enter the mail temple but see it from the Door only,4
202825100,2014,family,ritual_experience,negative,0.3,not necessarily fun to be the witness to these rituals,4
202825100,2014,family,sacred_atmosphere,positive,0.7,impressive stupas all offer interest,4
202825100,2014,family,spiritual_authenticity,positive,0.6,important to understand the role of cremation,4
957837214,2024,couples,spiritual_authenticity,positive,0.9,Pashupatinath is also regarded as jyotirlinga,5
549089387,2017,family,crowd_management,negative,0.3,temple is very crowded,5
549089387,2017,family,facility,positive,0.7,Well managed by the temple staff,5
159701297,2013,family,spiritual_authenticity,positive,0.8,has its own value for Hindu religion,4
159701297,2013,family,facility,positive,0.7,told by our guide,4
126830143,2012,unknown,ritual_experience,positive,0.7,being burned as part of the Hindu tradition,5
126830143,2012,unknown,facility,positive,0.6,best if you have a guide,5
126830143,2012,unknown,sacred_atmosphere,positive,0.8,each area has a story and is deep in history,5
436555996,2016,friends,sacred_atmosphere,positive,0.8,Every time it looks new to me,5
436555996,2016,friends,environment,positive,0.7,Animals are free to roam,5
436555996,2016,friends,facility,neutral,0.5,be ready for a frozen foot,5
306948759,2015,family,spiritual_authenticity,positive,0.9,feel inner peace after darshan,5
306948759,2015,family,ritual_experience,positive,0.85,attend evening Aarti,5
417221224,2016,friends,sacred_atmosphere,positive,0.9,sacred and beautiful,5
417221224,2016,friends,spiritual_authenticity,positive,0.85,very powerful,5
209249704,2014,friends,cultural_sensitivity,neutral,0.5,temple itself is not open to non-Hindus,4
209249704,2014,friends,sacred_atmosphere,positive,0.8,extraordinary place to visit,4
209249704,2014,friends,ritual_experience,positive,0.7,final stages of the Hindu cremation take place in the open air,4
302174646,2015,family,spiritual_authenticity,positive,0.9,its all about your spertural hunger,5
125008582,2012,business,sacred_atmosphere,positive,0.85,the atmosphere was overwhelming,5
941489757,2024,friends,sacred_atmosphere,positive,0.8,it was a cocktail of stimuli for our senses,5
941489757,2024,friends,access_fairness,neutral,0.5,after paying 1000 NPR,5
266943458,2015,friends,facility,negative,0.4,Some of the shops a little/lot tacky,5
266943458,2015,friends,environment,neutral,0.5,Monkeys and stray dogs abound but no real problems,5
266943458,2015,friends,sacred_atmosphere,positive,0.6,Worth a visit,5
728641199,2019,unknown,ritual_experience,positive,0.7,must-see touristy things,5
588220933,2018,couples,facility,negative,0.3,staff not geared for cleanliness,4
588220933,2018,couples,environment,negative,0.4,visitors do no care for cleanliness,4
588220933,2018,couples,sacred_atmosphere,positive,0.7,memorable religious monument,4
670783859,2019,couples,cultural_sensitivity,neutral,0.5,non-Hindus cannot enter the main temple,5
670783859,2019,couples,sacred_atmosphere,positive,0.7,plenty to see around the complex,5
670783859,2019,couples,environment,negative,0.3,aggressive monkeys which wander around,5
245795950,2014,unknown,facility,neutral,0.5,they want to sell guide services; I did not think it was necessary,4
245795950,2014,unknown,cultural_sensitivity,negative,0.3,one Monastery not allowed for foreign visitors,4
245795950,2014,unknown,sacred_atmosphere,negative,0.4,attention drawing even if very disturbing and making me extremely queasy,4
245795950,2014,unknown,environment,positive,0.7,"A very interesting area to walk around, get lost in",4
355195699,2016,solo,access_fairness,neutral,0.5,foreigners and non Hindu people ar not allowed Into the main temple,5
355195699,2016,solo,facility,positive,0.7,everyone was friendly there was a tourist market on the way out,5
574849829,2018,couples,sacred_atmosphere,positive,0.8,feel your faiths spirituality in the temple,5
574849829,2018,couples,facility,positive,0.7,hire a temple trust guide at a reasonable price,5
574849829,2018,couples,ritual_experience,positive,0.7,special puja if you wish,5
574849829,2018,couples,crowd_management,positive,0.6,No pushing etc and lovely experience,5
621395198,2018,family,ritual_experience,positive,0.8,"Overall, an experience you must not miss",5
621395198,2018,family,spiritual_authenticity,positive,0.9,soul needs solace,5
621395198,2018,family,crowd_management,negative,0.3,rather long queue,5
621395198,2018,family,cultural_sensitivity,positive,0.7,one must respect their privacy,5
873589381,2023,unknown,spiritual_authenticity,positive,0.9,Very Holy place ..it is a place to see the trust in Mahdve-God,5
873589381,2023,unknown,sacred_atmosphere,positive,0.85,one must see its a rare opportunity to see this beautiful temple,5
873589381,2023,unknown,facility,positive,0.7,shopping of moti and rudraksh from goverment approved stores,5
288039505,2015,friends,sacred_atmosphere,positive,0.8,i really refresh when i went to the pray time,5
288039505,2015,friends,spiritual_authenticity,positive,0.7,many artful structure of the temple,5
288039505,2015,friends,environment,positive,0.7,i really refresh the environment of pashupati temple,5
640029632,2018,solo,sacred_atmosphere,positive,0.8,beautiful pagoda style architecture,5
640029632,2018,solo,cultural_sensitivity,neutral,0.5,notice stating that the temple is for Hindus only,5
593900816,2018,couples,access_fairness,negative,0.3,Non Hindus are not allowed in the main temple,4
593900816,2018,couples,facility,neutral,0.5,Entrance is expensive by Nepalese standards,4
593900816,2018,couples,service,negative,0.4,Expect a guide to attach himself to you and then ask for a tip,4
236548856,2014,family,sacred_atmosphere,positive,0.8,mixture of calm and evocation,4
236548856,2014,family,facility,positive,0.7,a good guide to explain everything,4
236548856,2014,family,cultural_sensitivity,neutral,0.5,division of area between the commoners and those higher in society,4
162958916,2013,couples,environment,negative,0.3,"horribly polluted, complete with trash",5
162958916,2013,couples,ritual_experience,positive,0.7,cremated on pyres located above the river,5
162958916,2013,couples,crowd_management,negative,0.2,very aggressive folks trying to sell items,5
162958916,2013,couples,spiritual_authenticity,positive,0.8,a place to be respected and one needs to be cognizant of this,5
723757034,2019,unknown,cultural_sensitivity,neutral,0.5,restrictions are in place not to use mobiles inside,5
723757034,2019,unknown,sacred_atmosphere,positive,0.7,plenty of shiv lings inside,5
576742466,2018,couples,ritual_experience,positive,0.8,lucky to get the aarti,5
576742466,2018,couples,sacred_atmosphere,positive,0.7,had patience view,5
608235906,2018,friends,sacred_atmosphere,positive,0.8,The temple is very powerful and palpable,5
608235906,2018,friends,crowd_management,negative,0.3,There was a lot of rush,5
608235906,2018,friends,spiritual_authenticity,positive,0.7,Rituals for after death given a lot of importance,5
156241332,2013,couples,crowd_management,positive,0.8,far more peaceful than expected,5
156241332,2013,couples,sacred_atmosphere,positive,0.85,close contact to pilgrims and sadhus,5
736272281,2020,unknown,cultural_sensitivity,neutral,0.5,foreigners not alllowed in the inner temple,5
736272281,2020,unknown,ritual_experience,positive,0.8,made a huge impresion on both of us,5
458299673,2017,friends,spiritual_authenticity,positive,0.7,fascinating for a good look into Hindu culture,3
458299673,2017,friends,access_fairness,negative,0.3,"price for entering have just gone up, and it is getting rather expensive",3
