review_id,year,trip_type,aspect,sentiment,score,evidence,rating
736018747,2020,friends,spiritual_authenticity,positive,0.8,close to soul,5
736018747,2020,friends,sacred_atmosphere,positive,0.7,everything was different yet so close to soul,5
571167388,2018,family,sacred_atmosphere,positive,0.8,feel very pleasant atmosphere,4
571167388,2018,family,facility,negative,0.3,narayanhiti durbar but unfortunately it is closed,4
267547428,2015,friends,sacred_atmosphere,positive,0.8,amazed at how lovely the surroundings were,5
267547428,2015,friends,facility,negative,0.3,screamed at by a security officer in a very very rude tone,5
267547428,2015,friends,cultural_sensitivity,neutral,0.5,Please do not take photos,5
434823776,2016,family,spiritual_authenticity,positive,0.8,certain vibes which you feel when you offer prayers,5
207219759,2014,family,spiritual_authenticity,positive,0.9,calm and peaceful,5
207219759,2014,family,sacred_atmosphere,positive,0.9,happy and blessed,5
129251560,2012,friends,ritual_experience,positive,0.7,opens you up to the cycle of life,4
129251560,2012,friends,environment,negative,0.3,hard time breathing due to the smoke,4
129251560,2012,friends,facility,positive,0.6,home for the elderly that is worth walking through,4
635306302,2018,couples,sacred_atmosphere,positive,0.8,All fascinating to watch,5
715304647,2019,unknown,sacred_atmosphere,positive,0.85,architecture is just amazing,5
715304647,2019,unknown,spiritual_authenticity,positive,0.7,history very interesting,5
715304647,2019,unknown,facility,positive,0.8,excellent restaurants,5
567255007,2018,family,ritual_experience,negative,0.4,not possible to offer a prayer for more than a few seconds,4
567255007,2018,family,sacred_atmosphere,neutral,0.5,more a tourist attraction than a place of worship,4
567255007,2018,family,spiritual_authenticity,positive,0.7,"a blessing to be able to do this, once in a lifetime",4
472775895,2017,family,spiritual_authenticity,positive,0.9,One of the greatest iconic temple,5
472775895,2017,family,sacred_atmosphere,positive,0.85,marvellous architect in history,5
563944130,2018,family,environment,negative,0.3,rebuilded houses look not so nice,4
563944130,2018,family,spiritual_authenticity,positive,0.7,feel the spirit of Shiva,4
563944130,2018,family,sacred_atmosphere,positive,0.6,"worth visiting, because you still feel the spirit",4
148165373,2012,family,sacred_atmosphere,positive,0.8,I found it a beautiful calm place,5
148475949,2012,solo,spiritual_authenticity,positive,0.8,I liked the place for it's sense of spirituality,5
219681489,2014,solo,sacred_atmosphere,positive,0.8,just a beautiful temple,5
219681489,2014,solo,cultural_sensitivity,neutral,0.5,Photos arent allowed so pls respect that,5
390401445,2016,unknown,access_fairness,negative,0.3,non Hindus cannot go into the main area,5
390401445,2016,unknown,sacred_atmosphere,positive,0.7,Well worth a visit. This is an important Hindu shrine,5
360701467,2016,unknown,ritual_experience,neutral,0.5,watch the dead being burned as per local traditions,5
360701467,2016,unknown,environment,negative,0.3,strong smell and smoke,5
538141423,2017,family,facility,positive,0.8,Well worth it,5
538141423,2017,family,ritual_experience,positive,0.85,expedited darshan for 6 people,5
538141423,2017,family,sacred_atmosphere,positive,0.9,Beautiful temple,5
587608229,2018,unknown,ritual_experience,positive,0.8,received darshan and conducted poojas as we desired,5
587608229,2018,unknown,environment,positive,0.7,Neat and clean the premises,5
587608229,2018,unknown,crowd_management,neutral,0.5,Although crowded,5
241669791,2014,business,sacred_atmosphere,positive,0.9,The temple is beautiful & sacred,4
228240597,2014,family,sacred_atmosphere,positive,0.8,very beautiful place,5
228240597,2014,family,cultural_sensitivity,neutral,0.5,clicking photographs r not allowed,5
228240597,2014,family,facility,positive,0.7,tight security in temple,5
228240597,2014,family,spiritual_authenticity,positive,0.8,rest his mind,5
462875560,2017,solo,spiritual_authenticity,positive,0.9,Experience the divine,5
436710933,2016,friends,facility,positive,0.8,luxury minibus to visit,5
436710933,2016,friends,service,positive,0.9,very informative guide,5
436710933,2016,friends,sacred_atmosphere,positive,0.85,beautiful colorful reflective day,5
228939009,2014,family,sacred_atmosphere,positive,0.8,feel of our ancestors,5
228939009,2014,family,spiritual_authenticity,positive,0.85,stunning carvings on the buildings,5
367064241,2016,solo,sacred_atmosphere,positive,0.85,Vey Beautiful place to visit,5
238867144,2014,business,sacred_atmosphere,positive,0.7,well worth seeing given the scale and representation of life for believers,4
238867144,2014,business,spiritual_authenticity,positive,0.6,the cremations in progress complimented by the monkeys make it just that bit eerie,4
118328488,2011,couples,service,positive,0.8,"we were not disappointed, he was a student but was full of the history and knowledge",5
118328488,2011,couples,facility,neutral,0.5,entrance fee was 500 rupees per person,5
118328488,2011,couples,ritual_experience,positive,0.7,it was fascinating to hear all about the cremations,5
118328488,2011,couples,cultural_sensitivity,negative,0.3,one of them said after we had had our pictures taken that it was 100 rupees per holy man,5
559207355,2018,solo,sacred_atmosphere,positive,0.8,Recommends to visit,5
169507274,2013,solo,sacred_atmosphere,positive,0.85,Hindu architecture at this location is fantastic,4
235672355,2014,friends,access_fairness,negative,0.3,Expensive,3
235672355,2014,friends,sacred_atmosphere,neutral,0.5,Interesting place but not one to take photos as also a place of sadness,3
235672355,2014,friends,general_sentiment,positive,0.6,worth a visit,3
158601497,2013,solo,cultural_sensitivity,negative,0.3,Non-Hindus cannot enter the temple,3
158601497,2013,solo,sacred_atmosphere,negative,0.2,didn't have the feeling like a holy place,3
158601497,2013,solo,crowd_management,negative,0.3,get hassled from the street all the way to the temple complex,3
158601497,2013,solo,spiritual_authenticity,negative,0.2,kept trying to see and feel why it was holy but I couldn't,3
145071627,2012,couples,access_fairness,neutral,0.5,non-hinduist cannot go in the main temple,5
145071627,2012,couples,environment,positive,0.8,quite a vast area to walk about,5
145071627,2012,couples,sacred_atmosphere,positive,0.7,"worth going to the top of the hill, for another view of the valley",5
145071627,2012,couples,spiritual_authenticity,positive,0.7,worth the visit and you can linger there for hours,5
409172201,2016,friends,sacred_atmosphere,neutral,0.5,famous for Peace and Monkeys,5
409172201,2016,friends,spiritual_authenticity,neutral,0.5,not much worthy comparing with other temple,5
409172201,2016,friends,environment,neutral,0.5,famous for Peace and Monkeys,5
688470333,2019,friends,ritual_experience,positive,0.8,very worth a visit and really a must see,4
688470333,2019,friends,cultural_sensitivity,positive,0.7,with some respect we followed the rituals,4
688470333,2019,friends,sacred_atmosphere,neutral,0.5,a little shocking by moments but it's part of the culture,4
715432596,2019,friends,cultural_sensitivity,neutral,0.5,Entrance is restricted for Hindu only,5
715432596,2019,friends,access_fairness,neutral,0.5,main temple might be closed in late afternoon,5
715432596,2019,friends,sacred_atmosphere,positive,0.7,do roam around and check all surrounding smaller temples,5
542928209,2017,couples,service,positive,0.8,service offered at the entry gates for all tourists,4
542928209,2017,couples,facility,positive,0.7,footwear stored in bags and returned to them after their visit for no charge,4
542928209,2017,couples,sacred_atmosphere,positive,0.9,unique in energy and visual appeal,4
542928209,2017,couples,crowd_management,positive,0.8,barely a few people milling around in the main temple,4
233786171,2014,couples,access_fairness,negative,0.3,only Hindus are allowed in the main temple,3
233786171,2014,couples,environment,negative,0.3,Inside area is little dirty with cow and other animal dung,3
236803783,2014,friends,ritual_experience,positive,0.8,"witness several cremations, a blessing of a recently deceased person",5
236803783,2014,friends,sacred_atmosphere,positive,0.9,Visiting this place is an absolute must,5
236803783,2014,friends,facility,positive,0.7,enjoyed seeing the cotton candy vendor,5
460933578,2017,solo,sacred_atmosphere,positive,0.85,an incredible place with lots of emotionally intense moments,5
460933578,2017,solo,crowd_management,negative,0.4,ignore the people who want to sell you stuff ...they can be annoying,5
460933578,2017,solo,spiritual_authenticity,positive,0.7,its the second time i went and i like it most of all the temples to visit,5
280068616,2015,family,sacred_atmosphere,positive,0.85,most holy place in Nepal,4
280068616,2015,family,environment,positive,0.8,worth visiting,4
280068616,2015,family,crowd_management,negative,0.4,always crowded,4
537053767,2017,unknown,sacred_atmosphere,positive,0.7,nice to be there,4
190710853,2014,family,spiritual_authenticity,positive,0.8,"for the religious minded, it is a must",5
190710853,2014,family,facility,positive,0.7,buy rudraksh beads from the shops nearby,5
508086413,2017,friends,ritual_experience,positive,0.8,I am bery lucky to see that kind of prayer,4
508086413,2017,friends,sacred_atmosphere,positive,0.7,Pashupati has a holy river,4
508086413,2017,friends,environment,negative,0.4,there are many monkey too,4
149285992,2013,couples,service,positive,0.8,worth the $10 to have a guide,5
149285992,2013,couples,ritual_experience,positive,0.7,especially if cremations occurring,5
201651632,2014,unknown,access_fairness,neutral,0.5,pay some entry fees to go inside,4
201651632,2014,unknown,sacred_atmosphere,positive,0.8,splendid artitecture of the temple,4
309960648,2015,friends,environment,negative,0.3,place is not clean,3
309960648,2015,friends,cultural_sensitivity,positive,0.7,shoes removal is compulsory,3
309960648,2015,friends,facility,neutral,0.5,disposable socks to be worn,3
445984477,2016,family,cultural_sensitivity,positive,0.8,good policy not to let tourist to entered the beautiful main temple,4
445984477,2016,family,sacred_atmosphere,positive,0.7,it is really good,4
643729753,2019,solo,spiritual_authenticity,positive,0.9,One must attain salvation definitely by getting his / her funeral rights here.,5
479388832,2017,friends,environment,neutral,0.5,monkeys are everywhere and cremations happen by the river,4
479388832,2017,friends,ritual_experience,neutral,0.5,interesting but definitely not easy,4
479388832,2017,friends,sacred_atmosphere,negative,0.3,smell burning flesh,4
176591526,2013,business,cultural_sensitivity,neutral,0.5,main temple is out of bounds for the cameras,4
176591526,2013,business,sacred_atmosphere,positive,0.8,Nandi outside the main temple is grand & awe inspiring,4
122771879,2012,friends,ritual_experience,neutral,0.5,You have to know a bit about the rituals around the cremations,4
122771879,2012,friends,cultural_sensitivity,negative,0.3,"They live without money and just for the riligion, but they stronggly demand money for every picture you want to take",4
619070108,2018,couples,ritual_experience,positive,0.7,fascination insight into an aspect of Hinduism,4
619070108,2018,couples,facility,neutral,0.5,1000 rupee charge to get into the temple,4
619070108,2018,couples,environment,negative,0.4,evidence of earthquake damage,4
620429221,2018,friends,sacred_atmosphere,positive,0.8,sacred place for Shaiva Hindus,5
120400491,2011,solo,facility,positive,0.7,Get a guide and see this place,5
120400491,2011,solo,cultural_sensitivity,negative,0.3,non-Hindus cannot get into the temple,5
120400491,2011,solo,spiritual_authenticity,positive,0.8,fascinating introduction,5
120400491,2011,solo,service,negative,0.4,pseudo-Sadhus who will request money,5
546179576,2017,solo,cultural_sensitivity,positive,0.7,Most people were respectful of this keeping their distance,5
396447125,2016,friends,cultural_sensitivity,neutral,0.5,temple is for Hindu only,4
396447125,2016,friends,sacred_atmosphere,positive,0.7,looks beautiful from the outside,4
396447125,2016,friends,ritual_experience,positive,0.6,definitely cool to experience that aspect of another culture,4
154172046,2013,solo,environment,positive,0.8,forest and temple complexes up above are a tranquil place,4
154172046,2013,solo,ritual_experience,neutral,0.5,paths along the river are an open air funeral parlor,4
154172046,2013,solo,sacred_atmosphere,positive,0.7,pilgrims wander in peace,4
154172046,2013,solo,cultural_sensitivity,negative,0.3,"fake holy men, preening their moustaches and demanding huge fees for photos",4
240569554,2014,couples,sacred_atmosphere,positive,0.8,wonderful temples and adjoining buildings,5
240569554,2014,couples,facility,positive,0.85,guide who was worth every penny,5
247109464,2015,family,facility,negative,0.2,Temple complex needs serious cleaning,1
247109464,2015,family,service,negative,0.3,every minute somebody comes and asks if you want to do some special pooja,1
247109464,2015,family,access_fairness,negative,0.3,claim to get a fast darshan and it would take a long wait if you go in a normal way,1
247109464,2015,family,crowd_management,negative,0.4,The queue is not that long that you pay 200NPR and follow this crook,1
567612776,2018,friends,sacred_atmosphere,positive,0.8,peaceful place u will find,5
567612776,2018,friends,environment,positive,0.8,environment is clean,5
567612776,2018,friends,crowd_management,positive,0.7,not much crowded,5
567612776,2018,friends,access_fairness,positive,0.9,entrance is free,5
501526385,2017,couples,ritual_experience,negative,0.3,horrified at all the tourists taking pictures,5
501526385,2017,couples,cultural_sensitivity,negative,0.2,Please be respectful when you go,5
501526385,2017,couples,facility,negative,0.4,pestered by guides wanting money,5
501526385,2017,couples,sacred_atmosphere,negative,0.3,horrified at all the tourists taking pictures,5
131401409,2012,couples,ritual_experience,neutral,0.5,Quite strange watching funerals taking place,5
131401409,2012,couples,facility,positive,0.7,Get a guide to show you around,5
592127508,2018,family,spiritual_authenticity,positive,0.9,heart and mind becomes very peaceful and clam liked blessed by god shiva live,5
685647662,2019,couples,environment,negative,0.3,surroundings of the Pashupatinath temple are a bit disgraceful,4
685647662,2019,couples,sacred_atmosphere,positive,0.7,"temple itself is beautiful, and the process of cremation and burial add to its authenticity",4
685647662,2019,couples,access_fairness,negative,0.4,entrance fee,4
685647662,2019,couples,crowd_management,negative,0.3,monkeys and beggars complete the package,4
629678728,2018,solo,ritual_experience,neutral,0.5,Preparation for cremation takes place on one side of the bridge and cremation on the other,5
655449341,2019,couples,cultural_sensitivity,neutral,0.5,foreigners/non-hindus are not allowed to enter the main temple,4
655449341,2019,couples,ritual_experience,positive,0.7,"many cremations going on, something you won't see in most countries",4
258884460,2015,friends,access_fairness,neutral,0.5,non-Hindu's don't have access to the main temple,4
258884460,2015,friends,ritual_experience,positive,0.7,"cremations happening along the river, which is an interesting experience",4
459968506,2017,couples,access_fairness,neutral,0.5,pay 1000 rupees each,5
459968506,2017,couples,facility,positive,0.8,hired a guide... totally worth it!,5
459968506,2017,couples,sacred_atmosphere,positive,0.7,temples and monuments,5
459968506,2017,couples,ritual_experience,neutral,0.5,preparation for cremation from ghat,5
747546578,2020,couples,spiritual_authenticity,negative,0.3,it didn t give new knowledge,3
747546578,2020,couples,sacred_atmosphere,negative,0.3,This place was not interesting,3
747546578,2020,couples,service,negative,0.3,I don t want to recommend anyone to visit,3
539360945,2017,solo,sacred_atmosphere,positive,0.9,unequaled vibrancy .... there is a heart and soul to this place,5
539360945,2017,solo,spiritual_authenticity,positive,0.85,I felt completely different from when I arrived - something had shifted deep inside,5
539360945,2017,solo,facility,positive,0.8,A man slowly got into step beside me and in a completely disarming way became my companion and Guide,5
539360945,2017,solo,cultural_sensitivity,positive,0.7,do be respectful and not get too gawkish taking photos of Cremations,5
661856788,2019,friends,sacred_atmosphere,positive,0.9,"peaceful, positive vibes",5
661856788,2019,friends,crowd_management,positive,0.8,good management,5
583596752,2018,friends,sacred_atmosphere,positive,0.8,beautifully and artistically made indeed,4
583596752,2018,friends,cultural_sensitivity,neutral,0.5,not allowed to take pictures,4
583596752,2018,friends,environment,negative,0.3,aarti is done was very dirty,4
583596752,2018,friends,ritual_experience,neutral,0.5,funeral with the dead body are done in public,4
157243999,2013,couples,access_fairness,negative,0.3,ticket counter made me pay even though I am Indian,3
157243999,2013,couples,facility,negative,0.4,tour guide hovering around us tried to stop me,3
157243999,2013,couples,sacred_atmosphere,positive,0.8,the temple itself is beautiful,3
157243999,2013,couples,environment,negative,0.3,surrounding area that the tourists get to see is not really worth the entrance fee,3
524634655,2017,solo,ritual_experience,neutral,0.5,see cremation also,5
524634655,2017,solo,facility,positive,0.7,"experienced guide, much better",5
524634655,2017,solo,spiritual_authenticity,positive,0.8,most important place to visit,5
431821838,2016,couples,access_fairness,neutral,0.5,Non-Hindu's can not go into the center but you can visit all the surrounding grounds,5
431821838,2016,couples,sacred_atmosphere,positive,0.8,must see,5
590795990,2018,business,spiritual_authenticity,positive,0.9,one of the best temples dedicated to lord siva,5
800608947,2021,solo,sacred_atmosphere,positive,0.9,Peaceful,5
398018076,2016,couples,ritual_experience,positive,0.8,Booked for a Puja which was performed at 9.00 in the morning,5
398018076,2016,couples,facility,positive,0.9,Credit goes to the team who does the temple management,5
398018076,2016,couples,service,positive,0.8,People are very cooperative,5
398018076,2016,couples,spiritual_authenticity,positive,0.85,It was a beautiful experience,5
637857414,2018,friends,spiritual_authenticity,positive,0.8,We were blessed to see live cremation,5
372955502,2016,couples,spiritual_authenticity,positive,0.8,face-to-face with mortality,5
372955502,2016,couples,ritual_experience,neutral,0.5,open-air funeral pires are a natural way or grotesque,5
372955502,2016,couples,cultural_sensitivity,neutral,0.5,off-limits to non-Hindus,5
372955502,2016,couples,facility,positive,0.7,Bring a guide; you'll need one,5
569818411,2018,couples,spiritual_authenticity,positive,0.9,mystical and of mythological significance,5
569818411,2018,couples,sacred_atmosphere,positive,0.85,a must visit place for religious people,5
619290814,2018,solo,ritual_experience,positive,0.8,moving experience to watch Hindu cremation rituals,4
619290814,2018,solo,cultural_sensitivity,neutral,0.5,main temple is strictly for Hindus only,4
619290814,2018,solo,environment,negative,0.3,"monkeys everywhere, watch out for your personal stuff",4
520309168,2017,couples,sacred_atmosphere,positive,0.8,meditative atmosphere evoked by this pilgrimage locale,5
520309168,2017,couples,cultural_sensitivity,positive,0.7,proper etiquette is to be sensitive about taking photos of the cremations,5
520309168,2017,couples,environment,positive,0.75,enjoy that which is both rare and beautiful,5
520309168,2017,couples,crowd_management,neutral,0.5,"group was eventually banned from the site, most likely for safety reasons",5
408145095,2016,friends,sacred_atmosphere,negative,0.3,Not really an amazing place to visit,3
408145095,2016,friends,spiritual_authenticity,neutral,0.5,"If you are interested to learn about the Hindu traditions after death, you may visit",3
408145095,2016,friends,environment,negative,0.3,"Nothing much to see, when compared to the other temples",3
208018710,2014,couples,access_fairness,negative,0.4,"Entry, as everywhere, could have been cheaper",5
208018710,2014,couples,spiritual_authenticity,positive,0.9,once in a lifetime experience,5
208018710,2014,couples,sacred_atmosphere,positive,0.85,come to terms with what we were seeing,5
567919800,2018,couples,facility,positive,0.7,Our guide was very informative,3
567919800,2018,couples,cultural_sensitivity,negative,0.4,always feel like an outsider,3
567919800,2018,couples,access_fairness,negative,0.3,expect to pay quite a bit more then the entrance fee,3
567919800,2018,couples,sacred_atmosphere,positive,0.6,everyone is very nice too,3
160639822,2013,couples,cultural_sensitivity,neutral,0.5,it's quite acceptable for members of the public to observe,5
188235896,2013,friends,cultural_sensitivity,negative,0.3,non-Hindus can't go inside,3
188235896,2013,friends,sacred_atmosphere,neutral,0.5,larger world heritage site is pretty interesting,3
188235896,2013,friends,environment,negative,0.2,filthy river,3
188235896,2013,friends,spiritual_authenticity,neutral,0.5,sadhus-for-pay,3
722168502,2019,couples,facility,positive,0.7,Shoes counter is outside temple premises and is free,4
722168502,2019,couples,environment,negative,0.3,River bagmati (in a pretty bad dirty shape),4
722168502,2019,couples,crowd_management,positive,0.6,temple is clean and not very crowded,4
722168502,2019,couples,cultural_sensitivity,neutral,0.5,Photography not allowed,4
464715053,2017,couples,sacred_atmosphere,positive,0.85,"atmosphere is sobering, rich and religious",5
464715053,2017,couples,spiritual_authenticity,positive,0.9,we found it truly unique,5
464715053,2017,couples,ritual_experience,positive,0.8,cremation site be a highlight,5
448515854,2017,family,access_fairness,negative,0.3,entrance fee is a little high,1
448515854,2017,family,sacred_atmosphere,negative,0.4,not an enjoyable experience,1
301625955,2015,friends,sacred_atmosphere,positive,0.8,a temple with special atmosphere of death,5
301625955,2015,friends,cultural_sensitivity,neutral,0.5,Only followers of hindusim can enter the main temple,5
301625955,2015,friends,spiritual_authenticity,positive,0.9,"sadhus are wandering ascetic yogis, who are trying to acquire liberation",5
239716454,2014,solo,access_fairness,negative,0.3,entrance fee is quite high,4
239716454,2014,solo,facility,negative,0.4,loitering people offering their guidance services,4
239716454,2014,solo,ritual_experience,positive,0.7,experience is somewhat great and impressive,4
239716454,2014,solo,crowd_management,negative,0.3,"crowds of people (kids, adults, school classes)",4
592379284,2018,family,sacred_atmosphere,positive,0.8,It is a beautiful shivlinga,4
592379284,2018,family,environment,negative,0.3,Beware of monkeys,4
142552428,2012,solo,ritual_experience,neutral,0.5,solemn look into Hindus end of life practices,5
142552428,2012,solo,facility,positive,0.7,tourist police that are very friendly,5
142552428,2012,solo,service,positive,0.8,Licensed guides go through rigorous studies,5
142552428,2012,solo,service,negative,0.3,busting unlicensed guides,5
441944089,2016,friends,ritual_experience,positive,0.7,I was so fascinated on the burial rituals,5
441944089,2016,friends,spiritual_authenticity,positive,0.8,I could stay for hours,5
634529329,2018,unknown,access_fairness,negative,0.3,Expensive for tourists,5
634529329,2018,unknown,sacred_atmosphere,positive,0.7,Burial site for Kathmandu residents,5
634529329,2018,unknown,facility,positive,0.6,good restaurants and views,5
655916544,2019,friends,spiritual_authenticity,positive,0.8,always feel great to been there,5
151392698,2013,friends,sacred_atmosphere,positive,0.8,"haunting, too real, yet beautiful",4
151392698,2013,friends,environment,negative,0.3,smelled of burned corpses,4
151392698,2013,friends,spiritual_authenticity,positive,0.9,conscious about your presence and the meaning of life and death,4
151392698,2013,friends,facility,neutral,0.5,wanted to explore the hospice but my friend was too scared,4
184062950,2013,solo,facility,positive,0.7,worth getting a guide,5
184062950,2013,solo,sacred_atmosphere,positive,0.8,significance and history of the temples,5
180143012,2013,family,access_fairness,negative,0.3,admission fee is rather high,5
316234771,2015,solo,ritual_experience,positive,0.8,Really interesting and a must see,5
316234771,2015,solo,facility,neutral,0.5,you definately need a guide,5
654891413,2019,couples,cultural_sensitivity,neutral,0.5,open to Hindus only,5
654891413,2019,couples,access_fairness,neutral,0.5,Camera or photography is not allowed,5
654891413,2019,couples,ritual_experience,positive,0.7,Special pujas can be offered,5
146907345,2012,business,ritual_experience,positive,0.7,evening ceremonies and chanting from high on the bank opposite the temple are worth seeing,4
146907345,2012,business,cultural_sensitivity,neutral,0.5,Unless you are Hindu you wont be allowed in the main temple,4
146907345,2012,business,sacred_atmosphere,neutral,0.5,be prepared for the funeral pyres,4
208285382,2014,solo,access_fairness,negative,0.3,Entrance Fee to the place is expensive $1.000 rupees,5
208285382,2014,solo,cultural_sensitivity,neutral,0.5,be respectfull,5
165511474,2013,family,spiritual_authenticity,positive,0.9,really a divine treat,5
165511474,2013,family,sacred_atmosphere,positive,0.85,felt some strong force inside the temple premises,5
251885017,2015,friends,sacred_atmosphere,neutral,0.5,big area for 'common' people and a smaller and more peaceful for 'VIP' people,5
251885017,2015,friends,cultural_sensitivity,negative,0.3,"holy men here, and they expect to be paid",5
469366022,2017,friends,sacred_atmosphere,positive,0.8,really attraction place to visit,5
